"OneStream","OS","$29.10","$6,824,000,000","Sep 2024","$129,140,000","$516,560,000","20.69%","13.21","234,501,718","2024","2010","Tom Shea, Bob Powers, and Craig Colby","Birmingham, Michigan, United States","-$254,130,000","-$1,016,520,000","-3369.39%","-196.79%","-$171,940,000","-$687,760,000","-2642.03%","-133.14%","$495,460,000","–","D1 Capital Partners, Tiger Global, Investment Group of Santa Barbara","$200 million","1400","$369,000","Unified corporate performance management (CPM) platform designed to streamline financial consolidation, planning, reporting, and analysis.","","","http://www.onestream.com","https://investor.onestream.com/","https://www.sec.gov/Archives/edgar/data/1889956/000095017024079050/onestream_s-1_ipo.htm",""
"OpenText","OTEX","$28.01","$7,469,000,000","Sep 2024","$1,270,000,000","$5,080,000,000","-10.97%","1.47","266,654,766","1996","1991","Tom Jenkins, Tim Bray, Frank Tompa, Gaston Gonnet","Waterloo, Ontario, Canada","$366,420,000","$1,465,680,000","-3.71%","28.85%","$84,370,000","$337,480,000","4.29%","6.64%","$1,000,000,000","8.43%","Battery Ventures, Sequoia Capital","$1.5 million","24700","$205,700","Enterprise information management software with content management, business process management, and customer experience management features.","","","http://www.opentext.com","http://investors.opentext.com","","https://www.sec.gov/Archives/edgar/data/1002638/000100263824000052/otex-20240630.htm"
"Oracle","ORCL","$171.41","$479,426,000,000","Nov 2024","$14,060,000,000","$56,240,000,000","8.64%","8.52","2,796,954,670","1986","1977","Larry Ellison, Bob Miner, Ed Oates","Redwood City, California, United States","$5,640,000,000","$22,560,000,000","10.44%","40.11%","$3,150,000,000","$12,600,000,000","25.89%","22.40%","$11,310,000,000","30.16%","Sequoia Capital","$2 million","168000","$334,800","Wide range of enterprise software platforms, including database management systems, cloud services, and business applications.","","","http://www.oracle.com","http://investor.oracle.com","","https://www.sec.gov/Archives/edgar/data/1341439/000095017024075605/orcl-20240531.htm"
"Outbrain","OB","$7.60","$377,000,000","Sep 2024","$224,180,000","$896,720,000","-2.54%","0.42","49,605,263","2021","2006","Yaron Galai, Ori Lahav","New York City, United States","-$557,000","-$2,228,000","-110.69%","-0.25%","$6,700,000","$26,800,000","1218.11%","2.99%","$130,530,000","-22.58%","Lightspeed Venture Partners, Index Ventures, Gemini Israel Ventures","$99 million","1120","$800,600","Content discovery platform that recommends personalized articles, videos, and other content to users based on their interests and browsing behavior.","","","http://www.outbrain.com","http://investors.outbrain.com","https://www.sec.gov/Archives/edgar/data/1454938/000110465921086945/tm2113258-10_s1.htm","https://www.sec.gov/Archives/edgar/data/1454938/000145493824000024/outbrain-20231231.htm"
"PagerDuty","PD","$18.43","$1,662,000,000","Oct 2024","$118,950,000","$475,800,000","9.41%","3.49","90,179,056","2019","2010","Alex Solomon, Andrew Miklas, Baskar Puvanathasan, Dan Alexandru, Dan Mills, David Shackleton, Devananda van der Veen, Jennifer Tejada, John Laban, Julian Dunn, Michael Basnight, Ramin Sayar, Rob Malnati, Sean Higgins","San Francisco, California, United States","-$5,220,000","-$20,880,000","66.98%","-4.39%","-$6,560,000","-$26,240,000","56.64%","-5.51%","$542,160,000","-5.76%","Andreessen Horowitz, Accel, Bessemer Venture Partners","$173.6 million","1210","$393,200","Incident management platform that helps businesses respond to critical issues, providing real-time alerts, on-call scheduling, and automated escalations.","","","http://www.pagerduty.com","http://investor.pagerduty.com","https://www.sec.gov/Archives/edgar/data/1568100/000162828019003003/pagerdutys-1.htm","https://www.sec.gov/Archives/edgar/data/1568100/000156810024000013/pd-20240131.htm"
"Palantir","PLTR","$82.38","$187,581,000,000","Sep 2024","$725,520,000","$2,902,080,000","29.98%","64.64","2,277,021,122","2020","2003","Peter Thiel, Alex Karp, Joe Lonsdale, Stephen Cohen, and Adi Tatarko","Denver, Colorado, United States","$121,230,000","$484,920,000","149.20%","16.71%","$143,520,000","$574,080,000","100.72%","19.78%","$4,560,000,000","39.01%","Founders Fund, In-Q-Tel, 17 Capital, Tiger Global Management","$2.6 billion","3880","$748,000","Data integration, machine learning and data analysis platforms for governement and enterprise.","","","http://www.palantir.com","http://investors.palantir.com","https://www.sec.gov/Archives/edgar/data/1321655/000119312520230013/d904406ds1.htm","https://www.sec.gov/Archives/edgar/data/1321655/000132165524000022/pltr-20231231.htm"
"Palo Alto Networks","PANW","$189.51","$124,357,000,000","Oct 2024","$2,140,000,000","$8,560,000,000","13.88%","14.53","656,202,839","2012","2005","Nir Zuk","Santa Clara, California, United States","$327,400,000","$1,309,600,000","17.14%","15.30%","$350,700,000","$1,402,800,000","80.59%","16.39%","$3,390,000,000","-12.91%","Greylock Partners, Sequoia Capital","$65 million","10000","$856,000","Cybersecurity solutions including next-generation firewalls, cloud security, and threat intelligence services to protect organizations from cyber threats and safeguard their digital assets and networks","","","http://www.paloaltonetworks.com","http://investors.paloaltonetworks.com","https://www.sec.gov/Archives/edgar/data/1327567/000119312512153764/d318373ds1.htm","https://www.sec.gov/Archives/edgar/data/1327567/000132756724000029/panw-20240731.htm"
"PAR Technology","PAR","$75.11","$2,727,000,000","Sep 2024","$96,750,000","$387,000,000","40.83%","7.05","36,306,750","1983","1968","John W. Sammon Jr., Donald H. Foley","New Hartford, New York, United States","-$10,240,000","-$40,960,000","35.76%","-10.58%","-$19,830,000","-$79,320,000","-27.82%","-20.50%","$118,380,000","48.25%","BlackRock, Vanguard Group","N/A","1800","$215,000","Software solutions for the hospitality industry, including point-of-sale systems, workforce management, and food safety compliance.","","","http://www.partech.com","http://www.partech.com/investor-relations/","","https://www.sec.gov/Archives/edgar/data/708821/000070882124000014/par-20231231.htm"
"Paycom","PAYC","$209.75","$12,095,000,000","Sep 2024","$451,930,000","$1,807,720,000","11.23%","6.69","57,663,886","2014","1998","Chad Richison","Oklahoma City, Oklahoma, United States","$142,950,000","$571,800,000","13.59%","31.63%","$73,280,000","$293,120,000","-2.58%","16.21%","$325,760,000","-32.70%","N/A","$27 million","6550","$276,000","Human resources platform with features like payroll, HR, talent acquisition, and time and labor management.","","","http://www.paycom.com","http://investors.paycom.com","https://www.sec.gov/Archives/edgar/data/1590955/000119312514091543/d609623ds1.htm","https://www.sec.gov/Archives/edgar/data/1590955/000095017024015863/payc-20231231.htm"
"Paycor","PYCR","$19.18","$3,446,000,000","Sep 2024","$167,480,000","$669,920,000","16.64%","5.14","179,666,319","2021","1990","Bob Coughlin, Mike Braun","Cincinnati, Ohio, United States","$11,900,000","$47,600,000","151.43%","7.11%","-$7,280,000","-$29,120,000","64.63%","-4.35%","$97,620,000","79.85%","Apax Partners, Francisco Partners","$165 million","2900","$231,000","HR and payroll solutions, including timekeeping, benefits administration, and talent management.","","","http://www.paycor.com","http://investors.paycor.com","https://www.sec.gov/Archives/edgar/data/1839439/000119312521296896/d205942ds1.htm","https://www.sec.gov/Archives/edgar/data/1839439/000183943924000051/pycr-20240630.htm"
"Paylocity","PCTY","$201.19","$11,216,000,000","Sep 2024","$362,960,000","$1,451,840,000","14.29%","7.73","55,748,298","2014","1997","Steve Sarowitz","Schaumburg, Illinois, United States","$71,840,000","$287,360,000","47.29%","19.79%","$49,570,000","$198,280,000","43.62%","13.66%","$778,550,000","155.24%","Adams Street Partners, Great Hill Partners","$27 million","6300","$230,500","Payroll and human resources solutions for SMBs and Enterprise.","","","http://www.paylocity.com","http://investors.paylocity.com","https://www.sec.gov/Archives/edgar/data/1591698/000104746914002485/a2218484zs-1a.htm","https://www.sec.gov/Archives/edgar/data/1591698/000159169824000151/pcty-20240630.htm"
"Pegasystems","PEGA","$95.06","$8,152,000,000","Sep 2024","$325,050,000","$1,300,200,000","-2.87%","6.27","85,756,364","1996","1983","Alan Trefler","Cambridge, Massachusetts, United States","-$4,700,000","-$18,800,000","-140.39%","-1.45%","-$14,390,000","-$57,560,000","-97.69%","-4.43%","$702,990,000","109.03%","Bessemer Venture Partners, Matrix Partners","$5 million","6380","$203,800","Business process automation, operations management, and customer engagement solutions.","","","http://www.pega.com","http://www.pega.com/about/investors","","https://www.sec.gov/Archives/edgar/data/1013857/000101385724000012/pega-20231231.htm"
"Perion Network","PERI","$8.36","$405,000,000","Sep 2024","$102,200,000","$408,800,000","-44.85%","0.99","48,444,976","2006","2000","Ofer Adler, Yaron Adler","Tel Aviv, Israel","$769,000","$3,076,000","-97.97%","0.75%","$2,110,000","$8,440,000","-93.56%","2.06%","$383,860,000","-26.69%","N/A","$20 million","460","$888,700","Digital advertising tools, including ad-blocking, search monetization, and social media advertising.","","","http://www.perion.com","http://www.perion.com/investors/","",""
"Pros Holding","PRO","$22.55","$1,067,000,000","Sep 2024","$82,700,000","$330,800,000","7.06%","3.23","47,317,073","2007","1985","Andres Reiner, Ronald F. Woestemeyer","Houston, Texas, United States","$2,010,000","$8,040,000","137.92%","2.43%","$235,000","$940,000","101.69%","0.28%","$140,560,000","-11.64%","TA Associates, Fidelity Investments","$40 million","1650","$200,500","Pricing and revenue management solutions.","","","http://www.pros.com","http://ir.pros.com","https://www.sec.gov/Archives/edgar/data/1392972/000104746907002561/a2176970zs-1.htm","https://www.sec.gov/Archives/edgar/data/1392972/000139297224000025/pro-20231231.htm"
"PubMatic","PUBM","$15.37","$762,000,000","Sep 2024","$71,790,000","$287,160,000","12.73%","2.65","49,577,098","2020","2006","Rajeev Goel, Amar Goel, Anand Das, Amar Goel","Redwood City, California, United States","$5,120,000","$20,480,000","-27.20%","7.13%","-$912,000","-$3,648,000","-151.41%","-1.27%","$140,380,000","-18.08%","August Capital, Draper Fisher Jurvetson (DFJ), Helion Venture Partners, Nexus Venture Partners","$76 million","910","$315,600","Digital advertising with features like programmatic advertising, real-time bid management, and analytics.","","","http://www.pubmatic.com","http://investors.pubmatic.com","https://www.sec.gov/Archives/edgar/data/1422930/000162828020016438/pubmatics-12020.htm","https://www.sec.gov/Archives/edgar/data/1422930/000142293024000012/pubm-20231231.htm"
"Qualys","QLYS","$141.59","$5,181,000,000","Sep 2024","$153,870,000","$615,480,000","8.36%","8.42","36,591,567","2012","1999","Philippe Courtot","Foster City, California, United States","$49,340,000","$197,360,000","-1.88%","32.07%","$46,210,000","$184,840,000","-0.65%","30.03%","$386,340,000","-9.61%","Trident Capital, ABS Ventures","N/A","1500","$410,300","Cloud-based security and compliance solutions, including vulnerability management, threat protection, and asset inventory services","","","http://www.qualys.com","http://investor.qualys.com","https://www.sec.gov/Archives/edgar/data/1107843/000119312512265366/d355355ds1.htm","https://www.sec.gov/Archives/edgar/data/1107843/000110784324000008/qlys-20231231.htm"
"Rackspace Technology","RXT","$2.22","$505,000,000","Sep 2024","$675,800,000","$2,703,200,000","-7.73%","0.19","227,477,477","2020","1998","Graham Weston, Dirk Elmendorf, Pat Condon, Richard Yoo","San Antonio, Texas, United States","$51,600,000","$206,400,000","-33.59%","7.64%","-$186,600,000","-$746,400,000","17.65%","-27.61%","$193,400,000","-41.83%","Apollo Global Management","$1.3 billion","7000","$386,200","Managed cloud services, multi-cloud solutions, and professional services.","","","http://www.rackspace.com","http://ir.rackspace.com","https://www.sec.gov/Archives/edgar/data/1810019/000119312520190902/d915709ds1.htm","https://www.sec.gov/Archives/edgar/data/1810019/000181001924000042/rxt-20231231.htm"
"Rapid7","RPD","$39.81","$2,516,000,000","Sep 2024","$214,650,000","$858,600,000","7.95%","2.93","63,200,201","2015","2000","Alan Matthews, Tas Giakouminakis","Boston, Massachusetts, United States","$25,490,000","$101,960,000","33.05%","11.88%","$16,550,000","$66,200,000","121.61%","7.71%","$443,690,000","37.72%","Bain Capital Ventures, Technology Crossover Ventures","N/A","1900","$451,900","Cybersecurity solutions, including vulnerability management, incident detection and response, and security analytics","","","http://www.rapid7.com","http://investors.rapid7.com","https://www.sec.gov/Archives/edgar/data/1560327/000119312515220243/d908531ds1.htm","https://www.sec.gov/Archives/edgar/data/1560327/000156032724000021/rp-20231231.htm"
"RingCentral","RNG","$36.99","$3,329,000,000","Sep 2024","$608,760,000","$2,435,040,000","9.07%","1.37","89,997,297","2013","1999","Vlad Shmunis","Belmont, California, United States","$62,720,000","$250,880,000","564.69%","10.30%","-$7,850,000","-$31,400,000","81.35%","-1.29%","$212,650,000","-50.82%","Sequoia Capital, Khosla Ventures","N/A","4000","$608,800","Cloud-based communication and collaboration solutions, including voice, video, messaging, and contact center services.","","","http://www.ringcentral.com","http://ir.ringcentral.com","https://www.sec.gov/Archives/edgar/data/1384905/000119312513346260/d310247ds1.htm","https://www.sec.gov/Archives/edgar/data/1384905/000138490524000013/rng-20231231.htm"
"Riskified","RSKD","$4.81","$789,000,000","Sep 2024","$78,850,000","$315,400,000","9.71%","2.50","164,033,264","2021","2012","Eido Gal, Assaf Feldman, and Shaked Zin","Tel Aviv, Israel","-$13,520,000","-$54,080,000","44.28%","-17.15%","-$9,700,000","-$38,800,000","53.65%","-12.30%","$389,760,000","-13.48%","Qumra Capital, Pitango Venture Capital, Genesis Partners","$228 million","810","$389,400","Fraud prevention and chargeback protection solutions for e-commerce businesses.","","","http://www.riskified.com","http://ir.riskified.com","",""
"Rubrik","RBRK","$67.93","$5,917,000,000","Oct 2024","$236,180,000","$944,720,000","42.62%","6.26","87,104,372","2024","2014","Bipul Sinha, Arvind Jain, Soham Mazumdar, Arvind Nithrakashyap","Palo Alto, CA","-$116,090,000","-$464,360,000","-104.55%","-49.15%","-$130,910,000","-$523,640,000","-51.75%","-55.43%","$631,980,000","–","Lightspeed Venture Partners, Greylock Partners, Bain Capital Ventures","$550 million","3900","$242,200","Cloud data management platform that simplifies data protection, recovery, and management across hybrid environments.","","","http://www.rubrik.com","http://ir.rubrik.com","https://www.sec.gov/Archives/edgar/data/1943896/000119312524083525/d359771ds1.htm",""
"Rumble","RUM","$12.68","$3,601,000,000","Sep 2024","$25,060,000","$100,240,000","39.34%","35.92","283,990,536","2021","2016","Nikola Mrkšić, Adam Cann","San Francisco, California, United States","-$29,690,000","-$118,760,000","25.31%","-118.48%","-$31,540,000","-$126,160,000","-8.68%","-125.86%","$131,990,000","-50.57%","Sequoia Capital, Accel Partners","$60 million","70","$1,432,000","Video hosting, sharing, and monetization for content creators and businesses.","","","http://www.rumble.com","http://investors.rumble.com","https://www.sec.gov/Archives/edgar/data/1830081/000121390021005460/fs2021_cfacqcorp6.htm","https://www.sec.gov/Archives/edgar/data/1830081/000121390024026599/ea0202455-10k_rumble.htm"
"Sabre","SABR","$3.74","$1,443,000,000","Sep 2024","$764,710,000","$3,058,840,000","3.28%","0.47","385,828,877","2014","1960","American Airlines","Ventura, California, United States","$109,960,000","$439,840,000","25.10%","14.38%","-$62,820,000","-$251,280,000","69.84%","-8.21%","$669,300,000","10.11%","N/A","N/A","9000","$339,900","Technology solutions for the travel and tourism industry, including global distribution systems, airline and hospitality software, and travel management solutions.","","","http://www.sabre.com","http://investors.sabre.com","https://www.sec.gov/Archives/edgar/data/1597033/000119312514015201/d652688ds1.htm","https://www.sec.gov/Archives/edgar/data/1597033/000159703324000020/sabr-20231231.htm"
"Salesforce","CRM","$344.43","$329,620,000,000","Oct 2024","$9,440,000,000","$37,760,000,000","8.30%","8.73","957,001,423","2004","1999","Marc Benioff, Parker Harris, Dave Moellenhoff, Frank Dominguez","San Francisco, California, United States","$2,760,000,000","$11,040,000,000","14.27%","29.24%","$1,530,000,000","$6,120,000,000","24.75%","16.21%","$12,760,000,000","7.54%","Sequoia Capital","$64 million","80300","$470,200","Customer relationship management (CRM) software with a focus on enterprise. One of the first successful SaaS companies","","","http://www.salesforce.com","http://investor.salesforce.com","https://www.sec.gov/Archives/edgar/data/1108524/000119312503096073/ds1.htm","https://www.sec.gov/Archives/edgar/data/1108524/000110852424000005/crm-20240131.htm"
"Samsara","IOT","$45.55","$25,563,000,000","Nov 2024","$321,980,000","$1,287,920,000","35.55%","19.85","561,207,464","2021","2015","Sanjit Biswas, John Bicket, and John Sleiter","San Francisco, California, United States","-$37,000,000","-$148,000,000","20.18%","-11.49%","-$37,810,000","-$151,240,000","16.97%","-11.74%","$671,910,000","1.84%","Andreessen Horowitz, General Catalyst, Tiger Global Management","$930 million","2360","$545,700","Fleet management and industrial IoT solutions, including GPS tracking, real-time monitoring, and data analytics.","","","http://www.samsara.com","http://investors.samsara.com","https://www.sec.gov/Archives/edgar/data/1642896/000119312521334578/d261594ds1.htm","https://www.sec.gov/Archives/edgar/data/1642896/000164289624000016/iot-20240203.htm"
"Semrush","SEMR","$12.32","$1,807,000,000","Sep 2024","$97,410,000","$389,640,000","23.75%","4.64","146,672,078","2021","2008","Oleg Shchegolev, Dmitry Melnikov","Boston, Massachusetts, United States","$3,940,000","$15,760,000","-7.64%","4.04%","$1,090,000","$4,360,000","-74.05%","1.12%","$240,560,000","4.56%","Greycroft, e.ventures, Siguler Guff & Company","$40 million","1380","$282,300","Tools for SEO, content marketing, social media marketing, digital advertising, and competitive website research.","","","http://www.semrush.com","http://investors.semrush.com","https://www.sec.gov/Archives/edgar/data/1831840/000162828021003658/semrushforms-1.htm","https://www.sec.gov/Archives/edgar/data/1831840/000162828024009657/semr-20231231.htm"
"SentinelOne","S","$22.69","$7,291,000,000","Oct 2024","$210,650,000","$842,600,000","28.31%","8.65","321,330,983","2021","2013","Tomer Weingarten, Almog Cohen, Ehud Shamir, and Itay Yanovski","Mountain View, California, United States","-$78,400,000","-$313,600,000","-9.71%","-37.22%","-$78,360,000","-$313,440,000","-11.46%","-37.20%","$660,260,000","-17.26%","Insight Partners, Tiger Global Management, Third Point Ventures","$696 million","2310","$364,800","Endpoint security platform that uses AI to provide threat prevention, detection, and response.","","","http://www.sentinelone.com","http://investors.sentinelone.com","https://www.sec.gov/Archives/edgar/data/1583708/000162828021011624/sentineloneincs-1initialpu.htm","https://www.sec.gov/Archives/edgar/data/1583708/000158370824000016/s-20240131.htm"
"ServiceNow","NOW","$1,105.56","$227,745,000,000","Sep 2024","$2,800,000,000","$11,200,000,000","22.25%","20.33","205,999,674","2012","2004","Fred Luddy","Santa Clara, California, United States","$562,000,000","$2,248,000,000","49.07%","20.07%","$432,000,000","$1,728,000,000","78.51%","15.43%","$5,300,000,000","30.19%","JMI Equity, Sequoia Capital","$83.7 million","21200","$528,300","Solutions for IT service management, IT operations management, and IT business management.","","","http://www.servicenow.com","http://www.servicenow.com/company/investor-relations.html","https://www.sec.gov/Archives/edgar/data/1373715/000119312512280645/d301887ds1a.htm","https://www.sec.gov/Archives/edgar/data/1373715/000137371524000030/now-20231231.htm"
"Shopify","SHOP","$110.18","$204,434,000,000","Sep 2024","$2,160,000,000","$8,640,000,000","26.14%","23.66","1,855,454,710","2015","2006","Tobias Lütke, Daniel Weinand, Scott Lake","Ottawa, Canada","$291,000,000","$1,164,000,000","68.21%","13.47%","$828,000,000","$3,312,000,000","15.32%","38.33%","$4,900,000,000","-0.47%","OMERS Ventures, Bessemer Venture Partners, FirstMark Capital, Felicis Ventures","$122 million","12100","$714,000","E-commerce platform for the creation of online storefronts, management of inventory, processing payments, and tracking sales.","","","http://www.shopify.com","http://investors.shopify.com","",""
"Similarweb","SMWB","$14.53","$1,187,000,000","Sep 2024","$64,710,000","$258,840,000","18.01%","4.59","81,693,049","2021","2007","Or Offer, Nir Cohen, and Shlomi Hod","Tel Aviv, Israel","$934,000","$3,736,000","143.62%","1.44%","-$2,570,000","-$10,280,000","46.96%","-3.97%","$60,130,000","-10.80%","Viola Growth, Saban Ventures, Naspers, Insight Partners","$240 million","1160","$223,100","Insights and analytics on website traffic, audience behavior, and digital marketing strategies.","","","http://www.similarweb.com","http://ir.similarweb.com","",""
"Smartsheet","SMAR","$56.00","$7,840,000,000","Oct 2024","$286,870,000","$1,147,480,000","16.65%","6.83","140,000,000","2018","2005","Brent Frei, Mark Mader","Bellevue, Washington, United States","$4,140,000","$16,560,000","114.48%","1.44%","$1,320,000","$5,280,000","104.08%","0.46%","$760,920,000","33.79%","Sutter Hill Ventures, Insight Venture Partners, Madrona Venture Group","$113 million","3300","$347,700","Project management and productivity tool with features like task tracking, file sharing, and reporting.","","","http://www.smartsheet.com","http://investors.smartsheet.com","https://www.sec.gov/Archives/edgar/data/1366561/000162828018003554/smartsheets-1.htm","https://www.sec.gov/Archives/edgar/data/1366561/000136656124000062/smar-20240131.htm"
"Snowflake","SNOW","$163.06","$53,826,000,000","Oct 2024","$942,090,000","$3,768,360,000","28.32%","14.28","330,099,350","2020","2012","Benjamin Christian, Thierry Cruanes, Marcin Zukowski","San Mateo, California, United States","-$316,010,000","-$1,264,040,000","-35.60%","-33.54%","-$324,280,000","-$1,297,120,000","-51.35%","-34.42%","$4,160,000,000","17.15%","Sequoia Capital, Sutter Hill Ventures, ICONIQ Capital","$1.4 billion.","1430","$2,635,200","Data warehousing platform for large amounts of data and machine learning enablement.","","","http://www.snowflake.com","http://investors.snowflake.com","https://www.sec.gov/Archives/edgar/data/1640147/000162828020013010/snowflakes-1.htm","https://www.sec.gov/Archives/edgar/data/1640147/000164014724000101/snow-20240131.htm"
"SolarWinds","SWI","$14.44","$2,463,000,000","Sep 2024","$200,020,000","$800,080,000","5.50%","3.08","170,567,867","2018","1999","Donald Yonce, David Yonce, and Eugene Kim","Austin, Texas, United States","$72,840,000","$291,360,000","21.99%","36.42%","$12,570,000","$50,280,000","496.28%","6.28%","$199,190,000","-15.31%","Silver Lake Partners, Thoma Bravo","$20 million","2400","$333,400","Network management software for IT professionals to monitor, troubleshoot, and optimize their networks for performance and security.","","","http://www.solarwinds.com","http://investors.solarwinds.com","https://www.sec.gov/Archives/edgar/data/1739942/000162828018012025/solarwindss-1.htm","https://www.sec.gov/Archives/edgar/data/1739942/000173994224000020/swi-20231231.htm"
"SoundHound AI","SOUN","$20.24","$7,484,000,000","Sep 2024","$25,090,000","$100,360,000","89.13%","74.57","369,762,846","2022","2005","Keyvan Mohajer, Majid Emami","Santa Clara, California, United States","-$33,330,000","-$133,320,000","-138.08%","-132.84%","-$21,750,000","-$87,000,000","-7.69%","-86.69%","$135,610,000","41.04%","Khosla Ventures, NVIDIA, Samsung Catalyst Fund","$215 million","450","$223,000","Voice recognition technology to identify songs, provide lyrics, and offer music recommendations.","","","http://www.soundhound.com","http://investors.soundhound.com","https://www.sec.gov/Archives/edgar/data/1840856/000121390021009092/fs12021_archimedes.htm","https://www.sec.gov/Archives/edgar/data/1840856/000184085624000013/soun-20231231.htm"
"Spok Holdings","SPOK","$15.96","$324,000,000","Sep 2024","$34,870,000","$139,480,000","-1.58%","2.32","20,300,752","2002","1965","Vincent D. Kelly","Springfield, Virginia, United States","$6,360,000","$25,440,000","-15.83%","18.24%","$3,660,000","$14,640,000","-17.77%","10.50%","$27,830,000","1.94%","N/A","N/A","140","$996,300","Communication solutions for healthcare organizations, including secure messaging, call center management, and emergency notification systems.","","","http://www.spok.com","http://investors.spok.com","","https://www.sec.gov/Archives/edgar/data/1289945/000128994524000010/spok-20231231.htm"
"Spotify","SPOT","$461.64","$92,701,000,000","Sep 2024","$4,470,000,000","$17,880,000,000","18.80%","5.18","200,807,989","2018","2006","Daniel Ek, Martin Lorentzon","Stockholm, Sweden","$527,330,000","$2,109,320,000","592.65%","11.80%","$335,880,000","$1,343,520,000","361.54%","7.51%","$6,250,000,000","60.69%","Sequoia Capital, Technology Crossover Ventures, Accel Partners","$2.6 billion","8700","$2,055,200","B2C music streaming platform with vast library of songs, playlist functionality, discovery tools for new music.","","","http://www.spotify.com","http://investors.spotify.com","",""
