"Guidewire Software","GWRE","$174.62","$14,584,000,000","Oct 2024","$262,900,000","$1,051,600,000","26.76%","13.87","83,518,497","2012","2001","Marcus Ryu, Ken Branson, John Raguin","San Mateo, California, United States","$1,120,000","$4,480,000","104.02%","0.43%","$9,140,000","$36,560,000","133.76%","3.48%","$1,340,000,000","87.72%","Bain Capital Ventures, U.S. Venture Partners, Battery Ventures","$65 million","3510","$299,600","Solutions for the insurance industry, including claims management, policy administration, and billing.","","","http://www.guidewire.com","http://ir.guidewire.com","https://www.sec.gov/Archives/edgar/data/1528396/000119312511240194/ds1.htm","https://www.sec.gov/Archives/edgar/data/1528396/000152839624000105/gwre-20240731.htm"
"HashiCorp","HCP","$34.24","$7,000,000,000","Oct 2024","$173,390,000","$693,560,000","18.66%","10.09","204,439,252","2021","2012","Mitchell Hashimoto, Armon Dadgar","San Francisco, California, United States","-$26,410,000","-$105,640,000","50.04%","-15.23%","-$13,010,000","-$52,040,000","67.05%","-7.50%","$1,350,000,000","7.23%","GGV Capital, IVP (Institutional Venture Partners), Mayfield Fund","$349 million","2500","$277,400","Open-source tools and commercial products for cloud infrastructure automation, including Terraform, Vault, Consul, and Nomad sub-brands.","","","http://www.hashicorp.com","http://ir.hashicorp.com","https://www.sec.gov/Archives/edgar/data/1720671/000119312521319849/d205906ds1.htm","https://www.sec.gov/Archives/edgar/data/1720671/000162828024012350/hcp-20240131.htm"
"Health Catalyst","HCAT","$6.90","$420,000,000","Sep 2024","$76,350,000","$305,400,000","3.50%","1.38","60,869,565","2019","2008","Steven C. Barlow, Thomas D. Burton, Dale Sanders, Paul Horstmeier","Salt Lake City, Utah, United States","-$4,720,000","-$18,880,000","67.11%","-6.18%","-$14,730,000","-$58,920,000","33.16%","-19.29%","$387,260,000","11.38%","OrbiMed Advisors, Sequoia Capital, Norwest Venture Partners, Sands Capital Ventures","$377 million","1240","$246,300","Healthcare analytics platform to help organizations improve patient outcomes and reduce costs.","","","http://www.healthcatalyst.com","http://ir.healthcatalyst.com","https://www.sec.gov/Archives/edgar/data/1636422/000162828019008426/healthcatalysts-1.htm","https://www.sec.gov/Archives/edgar/data/1636422/000163642224000016/hcat-20231231.htm"
"HubSpot","HUBS","$721.36","$37,239,000,000","Sep 2024","$669,720,000","$2,678,880,000","20.12%","13.90","51,623,323","2014","2006","Brian Halligan, Dharmesh Shah","Cambridge, Massachusetts, United States","-$4,640,000","-$18,560,000","52.71%","-0.69%","$8,150,000","$32,600,000","327.73%","1.22%","$1,940,000,000","21.35%","General Catalyst, Matrix Partners","$100 million","7290","$367,500","Large variety of tools for marketing, sales, and customer service, both SMB and Enterprise focused.","","","http://www.hubspot.com","http://ir.hubspot.com","https://www.sec.gov/Archives/edgar/data/1404655/000119312514320044/d697256ds1.htm","https://www.sec.gov/Archives/edgar/data/1404655/000095017024015277/hubs-20231231.htm"
"Informatica","INFA","$26.93","$8,224,000,000","Sep 2024","$422,480,000","$1,689,920,000","3.41%","4.87","305,384,330","2021","1993","Gaurav Dhillon, Diaz Nesamoney, and Sanjay Poonen","Redwood City, California, United States","$86,240,000","$344,960,000","21.20%","20.41%","-$13,980,000","-$55,920,000","-117.64%","-3.31%","$1,240,000,000","42.69%","Silver Lake Partners, Microsoft","$71 million","6150","$274,800","Data integration and data management solutions.","","","http://www.informatica.com","http://investors.informatica.com","https://www.sec.gov/Archives/edgar/data/1868778/000119312521300476/d169828ds1a.htm","https://www.sec.gov/Archives/edgar/data/1868778/000186877824000006/infa-20231231.htm"
"Integral Ad Science","IAS","$10.36","$1,685,000,000","Sep 2024","$133,530,000","$534,120,000","10.97%","3.15","162,644,788","2021","2009","Scott Knoll, Will Luttrell","New York City, New York, United States","$27,260,000","$109,040,000","28.13%","20.41%","$16,090,000","$64,360,000","217.02%","12.05%","$57,080,000","-38.12%","August Capital, Sapphire Ventures","$116 million","860","$621,100","Digital ad verification and distribution solutions geared at brand safety, viewability, and ad fraud detection.","","","http://www.integralads.com","http://investors.integralads.com","https://www.sec.gov/Archives/edgar/data/1842718/000119312521181985/d35256ds1.htm","https://www.sec.gov/Archives/edgar/data/1842718/000184271824000013/ias-20231231.htm"
"Intellicheck","IDN","$2.77","$55,000,000","Sep 2024","$4,710,000","$18,840,000","-1.07%","2.92","19,855,596","1999","1994","William Roof","Melville, New York, United States","-$780,000","-$3,120,000","5.34%","-16.56%","-$837,000","-$3,348,000","-15.61%","-17.77%","$5,750,000","-35.50%","Crosslink Capital, Hudson Bay Capital Management","$15 million","60","$314,000","Identity verification solutions, including ID authentication, age verification, and fraud prevention.","","","http://www.intellicheck.com","http://www.intellicheck.com/investors","https://www.sec.gov/Archives/edgar/data/1040896/000114420414075072/v396872_s1.htm","https://www.sec.gov/Archives/edgar/data/1040896/000162828024013949/idn-20231231.htm"
"Intuit","INTU","$645.29","$180,628,000,000","Oct 2024","$3,280,000,000","$13,120,000,000","10.24%","13.77","279,917,556","1993","1983","Scott Cook, Tom Proulx","Mountain View, California, United States","$444,000,000","$1,776,000,000","-3.48%","13.54%","$197,000,000","$788,000,000","-18.26%","6.01%","$3,360,000,000","47.86%","Sequoia Capital","$1.3 million","9500","$1,381,100","Main application is QuickBooks, a financial management tool for accounting, invoicing, and tax preparation.","","","http://www.intuit.com","http://investors.intuit.com","","https://www.sec.gov/Archives/edgar/data/896878/000089687824000039/intu-20240731.htm"
"Jamf","JAMF","$14.64","$1,880,000,000","Sep 2024","$159,290,000","$637,160,000","11.68%","2.95","128,415,301","2020","2002","Zach Halmstad, Chip Pearson","Minneapolis, Minnesota, United States","-$2,860,000","-$11,440,000","82.29%","-1.80%","-$12,240,000","-$48,960,000","62.08%","-7.68%","$218,430,000","-4.04%","Vista Equity Partners","$49 million","2910","$219,000","Apple device management software that helps organizations manage and secure their Apple devices, with features like device deployment, inventory management, and security controls.","","","http://www.jamf.com","http://ir.jamf.com","https://www.sec.gov/Archives/edgar/data/1721947/000104746920003905/a2241939zs-1.htm","https://www.sec.gov/Archives/edgar/data/1721947/000162828024007212/jamf-20231231.htm"
"Jfrog","FROG","$30.49","$3,402,000,000","Sep 2024","$109,060,000","$436,240,000","23.04%","7.80","111,577,566","2020","2008","Shlomi Ben Haim, Yoav Landman, Fred Simon, Asaf Yigal","Sunnyvale, California, United States","-$20,580,000","-$82,320,000","-59.34%","-18.87%","-$22,940,000","-$91,760,000","-66.91%","-21.03%","$467,790,000","-6.85%","Battery Ventures, Sapphire Ventures","$227 million","1350","$323,100","DevOps platform for developers to manage and distribute software packages.","","","http://www.jfrog.com","http://investors.jfrog.com","https://www.sec.gov/Archives/edgar/data/1800667/000119312520228195/d841831ds1.htm","https://www.sec.gov/Archives/edgar/data/1800667/000095017024015873/frog-20231231.htm"
"Kaltura","KLTR","$2.33","$349,000,000","Sep 2024","$44,300,000","$177,200,000","1.73%","1.97","149,785,408","2021","2006","Ron Yekutiel, Shay David, Eran Etam","New York City, United States","-$3,220,000","-$12,880,000","54.40%","-7.27%","-$3,610,000","-$14,440,000","66.34%","-8.15%","$77,710,000","12.37%","Morgan Stanley, SAP, Goldman Sachs","$166 million","700","$253,100","Video platform for managing, creating, and distributing video content.","","","http://www.kaltura.com","http://investors.kaltura.com","https://www.sec.gov/Archives/edgar/data/1432133/000162828021003617/kalturas-1.htm","https://www.sec.gov/Archives/edgar/data/1432133/000143213324000088/kltr-20231231.htm"
"Karooooo","KARO","$47.20","$1,453,000,000","Aug 2024","$60,000,000","$240,000,000","6.39%","6.05","30,783,898","2021","2004","Zak Calisto","Midrand, South Africa","$27,320,000","$109,280,000","14.73%","45.53%","$12,320,000","$49,280,000","21.80%","20.53%","$41,160,000","8.55%","N/A","N/A","1000","$240,000","Telematics and fleet management solutions using advanced technology and data analytics to optimize vehicle tracking, driver behavior monitoring, and asset management","","","http://www.karooooo.com","http://www.karooooo.com/investor-relations","",""
"KingSoft Cloud","KC","$8.92","$2,154,000,000","Sep 2024","$270,000,000","$1,080,000,000","16.02%","1.99","241,479,821","2020","2012","Peng Lei","Beijing, China","$11,590,000","$46,360,000","186.55%","4.29%","-$150,000,000","-$600,000,000","-34.52%","-55.56%","$230,000,000","-38.06%","Xiaomi Corporation, Tencent Holdings Limited.","$1.8 billion","9790","$110,300","Cloud computing, including storage, data processing, and data analytics.","","","http://www.kingsoftcloud.com","http://ir.ksyun.com","",""
"Klaviyo","KVYO","$43.53","$11,737,000,000","Sep 2024","$235,090,000","$940,360,000","33.72%","12.48","269,630,140","2023","2012","Andrew Bialecki, Ed Hallen","Boston, Massachusetts, United States","-$10,020,000","-$40,080,000","96.65%","-4.26%","-$1,340,000","-$5,360,000","99.55%","-0.57%","$826,740,000","14.28%","Summit Partners, Shopify, Accel","$775 million","1600","$587,700","Targeted marketing automation system with features like email marketing, personalized messaging, segmentation, and analytics.","","","http://www.klaviyo.com","http://investors.klaviyo.com","https://www.sec.gov/Archives/edgar/data/1835830/000162828023030618/klaviyoincs-1.htm","https://www.sec.gov/Archives/edgar/data/1835830/000183583024000022/kvyo-20231231.htm"
"LegalZoom","LZ","$7.83","$1,353,000,000","Sep 2024","$168,600,000","$674,400,000","0.79%","2.01","172,796,935","2021","2001","Brian P. Liu, Robert Shapiro, Eddie Hartman, Brian S. Lee","Glendale, California, United States","$31,380,000","$125,520,000","84.82%","18.61%","$11,050,000","$44,200,000","46.68%","6.55%","$112,480,000","-46.98%","Kleiner Perkins, Institutional Venture Partners","$266 million","1410","$478,300","Legal documents, forms, and legal services for individuals and SMBs.","","","http://www.legalzoom.com","http://investors.legalzoom.com","https://www.sec.gov/Archives/edgar/data/1286139/000104746912005763/a2209299zs-1.htm","https://www.sec.gov/Archives/edgar/data/1286139/000128613924000031/lz-20231231.htm"
"Lightspeed POS","LSPD","$15.67","$3,438,000,000","Sep 2024","$277,180,000","$1,108,720,000","20.37%","3.10","219,400,128","2019","2005","Dax Dasilva","Montreal, Canada","-$6,940,000","-$27,760,000","71.91%","-2.50%","-$29,660,000","-$118,640,000","30.21%","-10.70%","$659,020,000","-13.46%","Accel Partners, Caisse de dépôt et placement du Québec (CDPQ), iNovia Capital.","$292 million","2600","$426,400","Point-of-sale solution with features like transaction processing, inventory management, analytics, and customer record management.","","","http://www.lightspeedhq.com","http://investors.lightspeedhq.com","",""
"LivePerson","LPSN","$0.85","$77,000,000","Sep 2024","$74,240,000","$296,960,000","-26.73%","0.26","90,588,235","2000","1995","Robert LoCascio","New York City, New York, United States","-$3,680,000","-$14,720,000","72.72%","-4.96%","-$28,310,000","-$113,240,000","46.90%","-38.13%","$142,100,000","-33.03%","Sierra Ventures, Benchmark Capital","$74 million","1350","$220,000","A customer messaging with real-time chatbots and customer data analytics.","","","http://www.liveperson.com","http://ir.liveperson.com","","https://www.sec.gov/Archives/edgar/data/1102993/000110299324000037/lpsn-20231231.htm"
"LiveRamp","RAMP","$30.90","$2,017,000,000","Sep 2024","$185,480,000","$741,920,000","16.02%","2.72","65,275,081","2018","2011","Aneel Bhusri, Mike Driscoll","San Francisco, California, United States","$12,330,000","$49,320,000","-25.90%","6.65%","$1,730,000","$6,920,000","-64.38%","0.93%","$348,440,000","-33.52%","Acxiom Ventures, Institutional Venture Partners (IVP)","$63 million","1420","$522,500","Data connectivity and data management solutions aimed at unifying data from various marketing platforms.","","","http://www.liveramp.com","http://investors.liveramp.com","","https://www.sec.gov/Archives/edgar/data/733269/000073326924000018/ramp-20240331.htm"
"Livongo","TDOC","$9.26","$1,594,000,000","Sep 2024","$640,510,000","$2,562,040,000","-2.99%","0.62","172,138,229","2015","2008","Glen Tullman, Lee Shapiro","Mountain View, California, United States","$13,390,000","$53,560,000","1.70%","2.09%","-$33,280,000","-$133,120,000","41.70%","-5.20%","$1,240,000,000","20.70%","General Catalyst, Kinnevik, Kleiner Perkins, Merck Global Health Innovation Fund, Sapphire Ventures","$235 million","4970","$515,500","Mobile application in the healthcare space for managing chronic conditions, providing personalized insights, coaching, and support.","","","http://www.livongo.com","http://ir.teladochealth.com","https://www.sec.gov/Archives/edgar/data/1477449/000104746915005109/a2224910zs-1.htm","https://www.sec.gov/Archives/edgar/data/1477449/000147744924000023/tdoc-20231231.htm"
"Logility Supply Chain Solutions","LGTY","$10.94","$368,000,000","Oct 2024","$25,290,000","$101,160,000","-1.57%","3.64","33,638,026","1983","1970","James C. Edenfield","Atlanta, Georgia, United States","$2,200,000","$8,800,000","-19.61%","8.70%","$1,740,000","$6,960,000","-26.45%","6.88%","$84,220,000","0.40%","N/A","N/A","510","$198,400","Supply chain management and enterprise retail and manufacturing solutions, including inventory management, demand planning, and collaboration tools.","","","http://www.logility.com","http://www.logility.com/company/investor-relations/","","https://www.sec.gov/Archives/edgar/data/713425/000162828024030530/amswa-20240430.htm"
"Marin Software","MRIN","$2.03","$6,000,000","Sep 2024","$4,280,000","$17,120,000","-3.52%","0.35","2,955,665","2013","2006","Chris Lien, Wister Walcott","San Francisco, California, United States","-$2,130,000","-$8,520,000","35.62%","-49.77%","-$2,330,000","-$9,320,000","53.05%","-54.44%","$5,590,000","-58.90%","Crosslink Capital, Benchmark Capital","$105 million","180","$95,100","Digital advertising management with features like ad campaign optimization, reporting, and audience targeting.","","","http://www.marinsoftware.com","http://investor.marinsoftware.com","https://www.sec.gov/Archives/edgar/data/1389002/000119312513055807/d450382ds1.htm","https://www.sec.gov/Archives/edgar/data/1389002/000095017024019131/mrin-20231231.htm"
"Marqeta","MQ","$3.70","$1,859,000,000","Sep 2024","$127,970,000","$511,880,000","17.52%","3.63","502,432,432","2021","2010","Jason Gardner, Omri Dahan, and Amy Pressman","Oakland, California, United States","-$39,280,000","-$157,120,000","42.42%","-30.69%","-$28,640,000","-$114,560,000","47.91%","-22.38%","$1,100,000,000","-14.89%","Coatue Management, Vitruvian Partners, Granite Ventures, Iconiq Capital","$528 million","990","$517,100","Card issuing platform, enabling businesses to create and manage payment cards.","","","http://www.marqeta.com","http://investors.marqeta.com","https://www.sec.gov/Archives/edgar/data/1522540/000119312521162113/d64065ds1.htm","https://www.sec.gov/Archives/edgar/data/1522540/000162828024007663/mq-20231231.htm"
"Match Group","MTCH","$33.22","$8,341,000,000","Jun 2024","$864,066,000","$3,456,264,000","4.16%","2.41","251,083,685","2020","1995","Gary Kremen, Peng T. Ong, Fran Maier, Will Bunker, Jim Young","Dallas, Texas, United States","$247,095,000","$988,380,000","1.22%","28.60%","$133,320,000","$533,280,000","-2.93%","15.43%","$843,604,000","-2.88%","Blackstone Group, General Atlantic","$1.8 billion","2820","$1,225,600","Online dating apps, including Tinder, OkCupid, and Match.com.","","","http://www.match.com","http://ir.mtch.com","","https://www.sec.gov/Archives/edgar/data/891103/000089110324000014/mtch-20231231.htm"
"Matterport","MTTR","$4.79","$1,547,000,000","Sep 2024","$43,790,000","$175,160,000","7.75%","8.83","322,964,509","2021","2011","David Gausebeck, Matt Bell","Sunnyvale, California, United States","-$39,130,000","-$156,520,000","5.09%","-89.36%","-$38,400,000","-$153,600,000","14.20%","-87.69%","$270,180,000","-33.75%","Lux Capital, DCM Ventures, Qualcomm Ventures, Greylock Partners","$116 million","610","$287,100","Platform for creating and sharing immersive 3D virtual tours and models of physical spaces.","","","http://www.matterport.com","http://investors.matterport.com","https://www.sec.gov/Archives/edgar/data/1819394/000119312520263889/d70164ds1.htm","https://www.sec.gov/Archives/edgar/data/1819394/000181939424000006/mttr-20231231.htm"
"MicroStrategy","MSTR","$358.18","$87,703,000,000","Sep 2024","$116,070,000","$464,280,000","-10.34%","188.90","244,857,334","1998","1989","Michael J. Saylor","Tysons, Virginia, United States","-$426,600,000","-$1,706,400,000","-1795.77%","-367.54%","-$340,170,000","-$1,360,680,000","-137.15%","-293.07%","$46,340,000","2.96%","American Research and Development Corporation, In-Q-Tel","$10 million","2170","$214,000","Business intelligence, mobile software, and cloud-based services for data analysis and visualization. Also well known for holding a lot of Bitcoin.","","","http://www.microstrategy.com","http://www.microstrategy.com/investor-relations","","https://www.sec.gov/Archives/edgar/data/1050446/000095017024015847/mstr-20231231.htm"
"Mitek Systems","MITK","$11.45","$514,000,000","Sep 2024","$43,220,000","$172,880,000","14.78%","2.97","44,890,830","1988","1986","John M. Thornton, James B. DeBello","San Diego, California, United States","$10,070,000","$40,280,000","2844.44%","23.30%","$8,570,000","$34,280,000","693.70%","19.83%","$130,340,000","-2.45%","Insight Venture Partners, Sutter Hill Ventures","$32 million","600","$288,100","Mobile capture and identity verification solutions enabling financial transactions through mobile devices.","","","http://www.miteksystems.com","http://investors.miteksystems.com","","https://www.sec.gov/Archives/edgar/data/807863/000095012324002926/mitk-20230930.htm"
"Monday","MNDY","$234.80","$11,723,000,000","Sep 2024","$251,000,000","$1,004,000,000","32.67%","11.68","49,927,598","2021","2012","Roy Mann, Eran Zinman, and Eran Yahav","New York City, New York, United States","-$24,200,000","-$96,800,000","-12635.26%","-9.64%","-$12,030,000","-$48,120,000","-260.60%","-4.79%","$1,390,000,000","31.64%","Insight Partners, Hamilton Lane","$234 million","1590","$631,400","Project management software that helps teams plan, track, and collaborate on tasks, with features like customizable workflows, automation, and visual dashboards.","","","http://www.monday.com","http://ir.monday.com","",""
"MongoDB","MDB","$243.00","$18,096,000,000","Oct 2024","$529,380,000","$2,117,520,000","22.28%","8.55","74,469,136","2017","2007","Eliot Horowitz, Dwight Merriman, Kevin Ryan","New York City, United States","-$24,480,000","-$97,920,000","38.05%","-4.62%","-$9,780,000","-$39,120,000","66.63%","-1.85%","$2,300,000,000","19.61%","Sequoia Capital, Flybridge Capital Partners, Union Square Ventures","$311 million","4690","$451,500","NoSQL database for storing and managing large volumes of unstructured data.","","","http://www.mongodb.com","http://investors.mongodb.com","https://www.sec.gov/Archives/edgar/data/1441816/000104746917006014/a2233365zs-1.htm","https://www.sec.gov/Archives/edgar/data/1441816/000144181624000049/mdb-20240131.htm"
"My Size","MYSZ","$4.17","$5,000,000","Sep 2024","$1,840,000","$7,360,000","-14.70%","0.68","1,199,041","2016","2014","Ronen Luzon","Airport City, Israel","-$507,000","-$2,028,000","50.25%","-27.55%","-$1,300,000","-$5,200,000","-14.84%","-70.65%","$2,370,000","-35.83%","N/A","$5.5 million.","40","$184,000","Mobile measurement solution, allowing users to accurately measure objects using their smartphone camera.","","","http://www.mysizeid.com","http://mysizeid.com/investors/","https://www.sec.gov/Archives/edgar/data/1211805/000121390017012574/fs12017_mysize.htm","https://www.sec.gov/Archives/edgar/data/1211805/000149315224012542/form10-k.htm"
"N-Able","NABL","$9.65","$1,793,000,000","Sep 2024","$116,440,000","$465,760,000","8.25%","3.85","185,803,109","2021","2000","Gavin Garbutt","Ottawa, Canada","$27,680,000","$110,720,000","21.57%","23.77%","$10,760,000","$43,040,000","78.90%","9.24%","$174,440,000","36.89%","Insight Partners","$4.5 million","1510","$308,500","Remote monitoring and management solutions for IT service providers.","","","http://www.n-able.com","http://investors.n-able.com","https://www.sec.gov/Archives/edgar/data/1834488/000162828021017497/nabl-20210823.htm","https://www.sec.gov/Archives/edgar/data/1834488/000183448824000032/nabl-20231231.htm"
"Ncino","NCNO","$35.27","$4,084,000,000","Oct 2024","$138,800,000","$555,200,000","13.82%","7.36","115,792,458","2020","2012","Pierre Naudé","Wilmington, North Carolina, United States","$11,630,000","$46,520,000","78.93%","8.38%","-$5,250,000","-$21,000,000","67.93%","-3.78%","$257,890,000","156.67%","Wellington Management, Salesforce Ventures","$213 million","1860","$298,500","Platform for financial institutions to streamline loan origination, document management, and customer relationship management.","","","http://www.ncino.com","http://investor.ncino.com","","https://www.sec.gov/Archives/edgar/data/1902733/000190273324000053/ncno-20240131.htm"
"Nerdy","NRDY","$1.69","$305,000,000","Sep 2024","$37,530,000","$150,120,000","-6.86%","2.03","180,473,373","2020","2015","Chuck Cohn","Chicago, Illinois, United States","-$25,350,000","-$101,400,000","-19.86%","-67.55%","-$15,900,000","-$63,600,000","-29.37%","-42.37%","$65,000,000","-22.65%","TPG Capital, Oakley Capital","$1.7 billion","730","$205,600","Online learning platform that connects students with tutors for personalized lessons in various subjects.","","","http://www.nerdy.com","http://investors.nerdy.com","https://www.sec.gov/Archives/edgar/data/1819404/000119312521299492/d189572ds1.htm","https://www.sec.gov/Archives/edgar/data/1819404/000181940424000019/nrdy-20231231.htm"
"Netflix","NFLX","$932.12","$398,442,000,000","Sep 2024","$9,820,000,000","$39,280,000,000","15.02%","10.14","427,457,838","2002","1997","Reed Hastings, Marc Randolph","Los Gatos, California, United States","$2,990,000,000","$11,960,000,000","48.99%","30.45%","$2,360,000,000","$9,440,000,000","40.90%","24.03%","$9,220,000,000","17.24%","Technology Crossover Ventures","$30 Million","13000","$3,021,500","Subscription-based streaming service for TV shows, movies, documentaries, etc.","","","http://www.netflix.com","http://ir.netflix.net","https://www.sec.gov/Archives/edgar/data/1065280/000101287002002125/ds1a.htm","https://www.sec.gov/Archives/edgar/data/1065280/000106528024000030/nflx-20231231.htm"
"Nice","NICE","$175.42","$39,853,000,000","Sep 2024","$689,960,000","$2,759,840,000","14.74%","14.44","227,186,182","1996","1986","Benny Levin","Ra'anana, Israel","$195,160,000","$780,640,000","24.82%","28.29%","$120,920,000","$483,680,000","30.93%","17.53%","$1,530,000,000","-7.56%","N/A","N/A","14000","$197,100","Software solutions for enterprise organizations, specializing in customer experience management, workforce optimization, and fraud prevention","","","http://www.nice.com","http://www.nice.com/company/investors","",""
"Okta","OKTA","$83.19","$14,255,000,000","Oct 2024","$665,000,000","$2,660,000,000","13.87%","5.36","171,354,730","2017","2009","Todd McKinnon, Frederic Kerrest","San Francisco, California, United States","$6,000,000","$24,000,000","106.98%","0.90%","$16,000,000","$64,000,000","119.75%","2.41%","$2,250,000,000","5.54%","Sequoia Capital, Andreessen Horowitz","$229 million","6020","$441,900","Identity management solutions for secure access to applications and data.","","","http://www.okta.com","http://investor.okta.com","https://www.sec.gov/Archives/edgar/data/1660134/000119312517080301/d289173ds1.htm","https://www.sec.gov/Archives/edgar/data/1660134/000166013424000025/okta-20240131.htm"
"Olo","OLO","$7.72","$1,264,000,000","Sep 2024","$71,850,000","$287,400,000","24.33%","4.40","163,730,570","2021","2005","Noah Glass, Matthew Tucker, and Damir Becirovic","New York City, New York, United States","-$2,380,000","-$9,520,000","71.62%","-3.31%","-$3,640,000","-$14,560,000","69.09%","-5.07%","$349,710,000","-7.18%","RRE Ventures, Tiger Global Management, The Raine Group","$91 million","750","$383,200","Online ordering platform for restaurants, enabling customers to order food for delivery or pickup.","","","http://www.olo.com","http://investors.olo.com","https://www.sec.gov/Archives/edgar/data/1431695/000119312521049073/d867519ds1.htm","https://www.sec.gov/Archives/edgar/data/1431695/000143169524000008/olo-20231231.htm"
"OneSpan","OSPN","$18.39","$699,000,000","Sep 2024","$56,240,000","$224,960,000","-4.41%","3.11","38,009,788","1998","1991","T. Kendall Hunt","Chicago, Illinois, United States","$13,890,000","$55,560,000","306.26%","24.70%","$8,270,000","$33,080,000","300.17%","14.70%","$77,480,000","13.11%","Bessemer Venture Partners, Trident Capital, Fidelity Investments","$47 million","820","$274,300","Digital identity and authentication solutions enabling secure transactions and preventing fraud.","","","http://www.onespan.com","http://investors.onespan.com","https://www.sec.gov/Archives/edgar/data/1044777/000095013606000265/file001.htm","https://www.sec.gov/Archives/edgar/data/1044777/000162828024009466/ospn-20231231.htm"
