"Company","Ticker","Stock Price","Market Cap","Last Quarter Filed","Last Quarter Revenue","Annualized Revenue","YoY Growth%","Revenue Multiple","Shares Outstanding (estimate)","IPO Year","Year Founded","Founder(s)","Headquarters","Last Quarter EBITDA","Annualized EBITDA","YoY Change in EBITDA%","EBITDA Margin","Last Quarter Net Income","Annualized Net Income","YoY Change in Net Income%","Net Income Margin","Cash and Short Term Investments","YoY Change in Cash and Short Term Investments%","Lead Investor(s) Pre-IPO","Pre-IPO Venture Funding Estimate","Employee Count (estimate)","Annual Revenue per Employee (estimate)","Product Description","September 2024 Website Traffic (Estimate)","YoY Change in Website Traffic%","Company Website","Company Investor Relations Page","S-1 Filing","2023 10-K Filing"
"8×8","EGHT","$2.68","$350,000,000","Sep 2024","$181,000,000","$724,000,000","-2.16%","0.48","130,597,015","1996","1987","Chi-Shin Wang, Y.W. Sing","","$14,120,000","$56,480,000","215.09%","7.80%","-$14,540,000","-$58,160,000","-95.16%","-8.03%","$117,400,000","-21.09%","N/A","N/A","2000","$362,000","Communication solutions, including cloud-based voice, video, chat, and contact center services","","","http://www.8×8.com","http://8×8.gcs-web.com","","https://www.sec.gov/Archives/edgar/data/1023731/000102373124000042/eght-20240331.htm"
"Adobe","ADBE","$447.94","$197,183,000,000","Nov 2024","$5,610,000,000","$22,440,000,000","11.05%","8.79","440,199,580","1986","1982","John Warnock, Charles Geschke","San Jose, California, United States","$2,180,000,000","$8,720,000,000","10.69%","38.86%","$1,680,000,000","$6,720,000,000","13.49%","29.95%","$7,890,000,000","0.56%","Sequoia Capital","$2.5 million","29800","$753,000","Applications for graphic design, video editing, web development, and document management.","","","http://www.adobe.com","http://www.adobe.com/investor-relations","","https://www.sec.gov/Archives/edgar/data/796343/000079634324000006/adbe-20231201.htm"
"Agilysys","AGYS","$138.93","$3,883,000,000","Sep 2024","$68,280,000","$273,120,000","16.49%","14.22","27,949,327","1983","1963","Arthur Rhein, William R. Loomis","Alpharetta, Georgia, United States","$8,340,000","$33,360,000","50.25%","12.21%","$1,360,000","$5,440,000","-69.99%","1.99%","$54,890,000","-48.90%","BlackRock, Vanguard Group","N/A","1690","$161,600","Hospitality management solutions, including point-of-sale, property management, and inventory management systems.","","","http://www.agilysys.com","http://www.agilysys.com/en/investor-relations/","","https://www.sec.gov/Archives/edgar/data/78749/000095017024063222/agys-20240331.htm"
"Akamai","AKAM","$96.91","$14,559,000,000","Sep 2024","$1,000,000,000","$4,000,000,000","4.06%","3.64","150,232,174","1999","1998","Tom Leighton, Daniel Lewin","Cambridge, Massachusetts, United States","$281,350,000","$1,125,400,000","-1.35%","28.14%","$57,910,000","$231,640,000","-63.93%","5.79%","$1,700,000,000","80.91%","Battery Ventures, Polaris Venture Partners","$8.3 million","9940","$402,400","Enterprise content delivery network (CDN) services, helping businesses deliver online content quickly and securely.","","","http://www.akamai.com","http://www.ir.akamai.com","","https://www.sec.gov/Archives/edgar/data/1086222/000108622224000040/akam-20231231.htm"
"Alight","ALIT","$6.84","$3,714,000,000","Sep 2024","$555,000,000","$2,220,000,000","-0.36%","1.67","542,982,456","2021","2019","Stephan Scholl","Chicago, Illinois, United States","$67,000,000","$268,000,000","4.69%","12.07%","-$74,000,000","-$296,000,000","-54.17%","-13.33%","$326,000,000","18.12%","Blackstone Group, Hellman & Friedman","$11.5 million","18300","$121,300","Platform for human resources, payroll, and financial operations.","","","http://www.alight.com","http://investor.alight.com","https://www.sec.gov/Archives/edgar/data/1809104/000110465920058905/tm2015214-3_s1.htm","https://www.sec.gov/Archives/edgar/data/1809104/000095017024022978/alit-20231231.htm"
"Alkami Technology","ALKT","$39.63","$3,983,000,000","Sep 2024","$85,910,000","$343,640,000","26.89%","11.59","100,504,668","2021","2009","Stephen Bohanon","Plano, Texas, United States","-$9,050,000","-$36,200,000","37.12%","-10.53%","-$9,440,000","-$37,760,000","38.99%","-10.99%","$100,990,000","-43.34%","General Atlantic, D1 Capital Partners","$225 million","870","$395,000","Digital banking platform that offers personalized banking experiences and advanced features for financial institutions.","","","http://www.alkami.com","http://investors.alkami.com","https://www.sec.gov/Archives/edgar/data/1529274/000119312521076443/d70489ds1.htm","https://www.sec.gov/Archives/edgar/data/1529274/000152927424000029/alk-20231231.htm"
"Amplitude","AMPL","$11.02","$1,362,000,000","Sep 2024","$75,220,000","$300,880,000","6.48%","4.53","123,593,466","2021","2012","Spenser Skates, Curtis Liu, Jeffrey Wang","San Francisco, California, United States","-$18,640,000","-$74,560,000","4.30%","-24.78%","-$16,850,000","-$67,400,000","5.03%","-22.40%","$319,940,000","-0.48%","Benchmark Capital, IVP (Institutional Venture Partners)","$186 million","720","$417,900","Platform for the measurement, storage, and analysis of user behavior in apps and on websites.","","","http://www.amplitude.com","http://investors.amplitude.com","https://www.sec.gov/Archives/edgar/data/1866692/000119312521260696/d143868ds1.htm","https://www.sec.gov/Archives/edgar/data/1866692/000095017024017102/ampl-20231231.htm"
"Ansys","ANSS","$342.84","$29,981,000,000","Sep 2024","$601,890,000","$2,407,560,000","31.19%","12.45","87,448,956","1996","1970","John Swanson","Canonsburg, Pennsylvania, United States","$197,330,000","$789,320,000","90.29%","32.79%","$128,190,000","$512,760,000","130.97%","21.30%","$1,300,000,000","102.54%","Battery Ventures, Commonwealth Capital Ventures","N/A","5750","$418,700","Engineering simulation solutions, for product design and testing virtually before physical prototypes are built.","","","http://www.ansys.com","http://investors.ansys.com","","https://www.sec.gov/Archives/edgar/data/1013462/000101346224000007/anss-20231231.htm"
"AppFolio","APPF","$252.67","$9,180,000,000","Sep 2024","$205,730,000","$822,920,000","24.36%","11.16","36,331,975","2015","2006","Brian Donahoo, Klaus Schauser, Jonathan Walker","Santa Barbara, California, United States","$43,680,000","$174,720,000","1638.16%","21.23%","$33,010,000","$132,040,000","24.81%","16.05%","$331,370,000","73.01%","N/A","$30 million","1830","$449,700","Property management solutions, including online rent payments, maintenance requests, and tenant screening.","","","http://www.appfolio.com","http://ir.appfolioinc.com","https://www.sec.gov/Archives/edgar/data/1433195/000119312515191809/d907976ds1.htm","https://www.sec.gov/Archives/edgar/data/1433195/000143319524000023/appf-20231231.htm"
"Appian","APPN","$34.51","$2,550,000,000","Sep 2024","$154,050,000","$616,200,000","12.37%","4.14","73,891,626","2017","1999","Matt Calkins, Michael Beckley, and Bob Kramer","McLean, Virginia, United States","-$4,600,000","-$18,400,000","64.31%","-2.99%","-$2,100,000","-$8,400,000","90.56%","-1.36%","$139,990,000","-17.40%","New Enterprise Associates (NEA), Novak Biddle Venture Partners, Kinetic Ventures","$196 million","2370","$260,000","Low-code development platform that enables businesses to build and deploy enterprise applications.","","","http://www.appian.com","http://investors.appian.com","https://www.sec.gov/Archives/edgar/data/1441683/000119312517143330/d363139ds1.htm","https://www.sec.gov/Archives/edgar/data/1441683/000144168324000016/appn-20231231.htm"
"AppLovin","APP","$341.83","$114,715,000,000","Sep 2024","$1,200,000,000","$4,800,000,000","38.64%","23.90","335,590,791","2021","2012","Adam Foroughi, Andrew Karam","Palo Alto, California, United States","$634,570,000","$2,538,280,000","105.95%","52.88%","$434,420,000","$1,737,680,000","299.87%","36.20%","$567,600,000","69.89%","KKR, Orient Hontai Capital","$2 billion","830","$5,783,100","Mobile advertising platform geared towards app developers to optimize their app listings and targeted ads.","","","http://www.applovin.com","http://investors.applovin.com","https://www.sec.gov/Archives/edgar/data/1751008/000119312521065782/d73804ds1.htm","https://www.sec.gov/Archives/edgar/data/1751008/000175100824000012/app-20231231.htm"
"AppTech Payments","APCX","$0.84","$23,000,000","Sep 2024","$43,000","$172,000","-69.29%","133.72","27,380,952","1999","2012","Eric Ottens, Luke D'Angelo","Las Vegas, Nevada, United States","-$1,600,000","-$6,400,000","42.13%","-3720.93%","-$2,020,000","-$8,080,000","29.96%","-4697.67%","$104,000","-58.57%","N/A","$1.5 million","30","$5,700","Mobile payments, with features like digital wallets and transaction processing.","","","http://www.apptechcorp.com","http://www.apptechcorp.com/departments/investor-relations/","https://www.sec.gov/Archives/edgar/data/1070050/000157570521000053/apcx_s1.htm","https://www.sec.gov/Archives/edgar/data/1070050/000168316824002017/apptech_i10k-123123.htm"
"Asana","ASAN","$21.98","$5,027,000,000","Oct 2024","$183,880,000","$735,520,000","10.44%","6.83","228,707,916","2020","2008","Dustin Moskovitz, Justin Rosenstein","San Francisco, California, United States","-$55,740,000","-$222,960,000","6.92%","-30.31%","-$57,330,000","-$229,320,000","7.16%","-31.18%","$455,310,000","-14.10%","Generation Investment Management, 8VC, Founders Fund","$213.2 million","1800","$408,600","Project management solution for task management, collaboration, and progress tracking.","","","http://www.asana.com","http://investors.asana.com","https://www.sec.gov/Archives/edgar/data/1477720/000119312520228462/d855753ds1.htm","https://www.sec.gov/Archives/edgar/data/1477720/000147772024000011/asan-20240131.htm"
"Asure Software","ASUR","$9.14","$243,000,000","Sep 2024","$29,300,000","$117,200,000","-0.10%","2.07","26,586,433","1992","1985","Pat Goepel","Austin, Texas, United States","$2,220,000","$8,880,000","-53.97%","7.58%","-$3,900,000","-$15,600,000","-76.84%","-13.31%","$11,250,000","-65.69%","Bessemer Venture Partners, Austin Ventures","$40 million","510","$229,800","Workforce management, including time and attendance tracking, scheduling, and workspace management.","","","http://www.asuresoftware.com","http://investor.asuresoftware.com","","https://www.sec.gov/Archives/edgar/data/884144/000088414424000022/asur-20231231.htm"
"Atlassian","TEAM","$257.49","$67,087,000,000","Sep 2024","$1,190,000,000","$4,760,000,000","21.48%","14.09","260,542,157","2015","2002","Mike Cannon-Brookes, Scott Farquhar","Sydney, Australia","-$9,150,000","-$36,600,000","-141.77%","-0.77%","-$123,770,000","-$495,080,000","-288.20%","-10.40%","$2,220,000,000","-2.21%","Accel Partners, T. Rowe Price, Dragoneer Investment Group","$210 million","11000","$432,700","Collaboration and productivity tools, including sub-brands Jira, Confluence, and Trello.","","","http://www.atlassian.com","http://investors.atlassian.com","","https://www.sec.gov/Archives/edgar/data/1650372/000165037224000036/team-20240630.htm"
"Autodesk","ADSK","$301.23","$64,764,000,000","Oct 2024","$1,570,000,000","$6,280,000,000","11.03%","10.31","214,998,506","1994","1982","John Walker, Dan Drake","San Rafael, California, United States","$367,000,000","$1,468,000,000","2.23%","23.38%","$275,000,000","$1,100,000,000","14.11%","17.52%","$1,710,000,000","-12.33%","Crosspoint Venture Partners, Sequoia Capital","$26 million","13900","$451,800","Design and engineering software for various industries, including architecture, engineering, construction, and manufacturing.","","","http://www.autodesk.com","http://investors.autodesk.com","","https://www.sec.gov/Archives/edgar/data/769397/000076939724000090/adsk-20240131.htm"
"Automatic Data Processing","ADP","$296.46","$120,795,000,000","Sep 2024","$4,830,000,000","$19,320,000,000","7.10%","6.25","407,458,004","1983","1949","Henry Taub, Joe Taub","Roseland, New Jersey, United States","$1,420,000,000","$5,680,000,000","12.00%","29.40%","$956,300,000","$3,825,200,000","11.28%","19.80%","$6,770,000,000","364.77%","Warburg Pincus, General Atlantic","N/A","64200","$300,900","Human resources solutions, including payroll, HR, time and attendance, and benefits administration.","","","http://www.adp.com","http://investors.adp.com","","https://www.sec.gov/Archives/edgar/data/8670/000000867024000024/adp-20240630.htm"
"AvePoint","AVPT","$17.80","$3,338,000,000","Sep 2024","$88,800,000","$355,200,000","22.05%","9.40","187,528,090","2019","2001","Tianyi Jiang, Kai Gong","Jersey City, New Jersey, United States","$9,050,000","$36,200,000","931.81%","10.19%","$2,620,000","$10,480,000","162.20%","2.95%","$249,980,000","19.45%","Ticonderoga Capital, Goldman Sachs, Summit Partners","$294 million","2250","$157,900","Software solutions on top of Microsoft Office 365 and SharePoint, including data management, governance, and data migration tools.","","","http://www.avepoint.com","http://ir.avepoint.com","https://www.sec.gov/Archives/edgar/data/1777921/000121390019016033/fs12019_apextechnology.htm","https://www.sec.gov/Archives/edgar/data/1777921/000143774924006145/avpt20231231_10k.htm"
"Aware","AWRE","$1.50","$32,000,000","Sep 2024","$3,850,000","$15,400,000","-39.68%","2.08","21,333,333","1996","1986","Edmund Reiter","Bedford, Massachusetts, United States","-$1,320,000","-$5,280,000","-1890.54%","-34.29%","-$1,170,000","-$4,680,000","-202.01%","-30.39%","$27,390,000","-0.48%","Venrock, Sigma Partners","$100 million","90","$171,100","Biometric authentication solutions, including face and voice recognition, for access management.","","","http://www.aware.com","http://www.aware.com/investor-relations/","","https://www.sec.gov/Archives/edgar/data/1015739/000095017024032239/awre-20231231.htm"
"Backblaze","BLZE","$6.37","$322,000,000","Sep 2024","$32,590,000","$130,360,000","28.82%","2.47","50,549,451","2021","2007","Gleb Budman, Brian Wilson","San Mateo, California, United States","-$6,770,000","-$27,080,000","32.20%","-20.77%","-$12,750,000","-$51,000,000","20.57%","-39.12%","$20,880,000","-29.81%","T. Rowe Price, Bessemer Venture Partners","$5.3 million","420","$310,400","Cloud backup and storage solution.","","","http://www.backblaze.com","http://ir.backblaze.com","https://www.sec.gov/Archives/edgar/data/1462056/000119312521301141/d62601ds1.htm","https://www.sec.gov/Archives/edgar/data/1462056/000146205624000033/blze-20231231.htm"
"Bentley Systems","BSY","$48.01","$14,507,000,000","Sep 2024","$335,170,000","$1,340,680,000","9.32%","10.82","302,166,215","2020","1984","Keith Bentley, Barry Bentley","Exton, Pennsylvania, United States","$87,120,000","$348,480,000","-7.46%","25.99%","$42,340,000","$169,360,000","-20.16%","12.63%","$72,180,000","7.78%","N/A","$1.05 billion","5140","$260,800","Platform for infrastructure design, construction, and operation. Its main features include 3D modeling, simulation, and collaboration tools.","","","http://www.bentley.com","http://investors.bentley.com","https://www.sec.gov/Archives/edgar/data/1031308/000089322002000491/w59294s-1.htm","https://www.sec.gov/Archives/edgar/data/1031308/000103130824000002/bsy-20231231.htm"
"Big Commerce","BIGC","$6.28","$492,000,000","Sep 2024","$83,710,000","$334,840,000","7.26%","1.47","78,343,949","2020","2009","Eddie Machaalani, Mitchell Harper","Austin, Texas, United States","-$5,520,000","-$22,080,000","54.77%","-6.59%","-$6,990,000","-$27,960,000","65.57%","-8.35%","$168,400,000","-36.54%","General Catalyst, GGV Capital, SoftBank","$415 million","1550","$216,000","E-commerce platform for online stores, with customizable web templates and widgets, payment processing, and inventory management.","","","http://www.bigcommerce.com","http://investors.bigcommerce.com","https://www.sec.gov/Archives/edgar/data/1626450/000119312520191966/d844671ds1.htm","https://www.sec.gov/Archives/edgar/data/1626450/000095017024022864/bigc-20231231.htm"
"BILL Holdings","BILL","$87.04","$9,008,000,000","Sep 2024","$358,450,000","$1,433,800,000","17.53%","6.28","103,492,647","2019","2006","René Lacerte","San Jose, California, United States","$12,410,000","$49,640,000","137.94%","3.46%","$8,910,000","$35,640,000","131.99%","2.49%","$1,470,000,000","-44.34%","Mastercard, Franklin Templeton, Bank of America","$345 million","2600","$551,500","Cloud-based software to streamline and automate accounts payable and accounts receivable processes","","","http://www.bill.com","http://investor.bill.com","https://www.sec.gov/Archives/edgar/data/1786352/000119312519293348/d710902ds1.htm","https://www.sec.gov/Archives/edgar/data/1786352/000178635224000035/bill-20240630.htm"
"Blackboxstocks","BLBX","$1.79","$6,000,000","Sep 2024","$647,840","$2,591,360","-11.07%","2.32","3,351,955","2015","2018","Todd M. Mitchell","Boca Raton, Florida, United States","-$731,630","-$2,926,520","14.74%","-112.93%","-$780,830","-$3,123,320","-16.24%","-120.53%","$60,920","-86.91%","N/A","$2.5 million.","17","$152,400","Real-time stock market data, alerts, and analysis for stock traders.","","","http://www.blackboxstocks.com","N/A","https://www.sec.gov/Archives/edgar/data/1567900/000143774921023307/blkbx20211001_s1.htm","https://www.sec.gov/Archives/edgar/data/1567900/000143774924010302/blkbx20231231_10k.htm"
"Blend Labs","BLND","$4.50","$1,152,000,000","Sep 2024","$45,180,000","$180,720,000","11.32%","6.37","256,000,000","2021","2012","Nima Ghamsari, Erin Collard, Rosco Hill","San Francisco, California, United States","-$6,470,000","-$25,880,000","75.55%","-14.32%","-$2,440,000","-$9,760,000","94.15%","-5.40%","$116,780,000","-52.33%","General Atlantic, Tiger Global Management, 8VC","$665 million","1580","$114,400","A digital lending platform for financial institutions geared towards the automation of the lending process.","","","http://www.blend.com","http://investor.blend.com","https://www.sec.gov/Archives/edgar/data/1855747/000119312521194971/d162671ds1.htm","https://www.sec.gov/Archives/edgar/data/1855747/000185574724000015/blnd-20231231.htm"
"Box","BOX","$32.02","$4,601,000,000","Oct 2024","$275,910,000","$1,103,640,000","5.50%","4.17","143,691,443","2015","2005","Aaron Levie, Dylan Smith","Redwood City, California, United States","$29,340,000","$117,360,000","13.31%","10.63%","$12,890,000","$51,560,000","20.99%","4.67%","$697,920,000","58.72%","Draper Fisher Jurvetson, U.S. Venture Partners, Scale Venture Partners","$547 million","2560","$431,100","Content management and file sharing platform for file storage, access management, and collaboration.","","","http://www.box.com","http://www.boxinvestorrelations.com","https://www.sec.gov/Archives/edgar/data/1372612/000119312514112417/d642425ds1.htm","https://www.sec.gov/Archives/edgar/data/1372612/000095017024029241/box-20240131.htm"
"Braze","BRZE","$43.60","$4,512,000,000","Oct 2024","$152,050,000","$608,200,000","22.67%","7.42","103,486,239","2021","2011","Jon Hyman, Mark Ghermezian, Bill Magnuson, and Jon Hyman","New York City, United States","-$30,730,000","-$122,920,000","7.97%","-20.21%","-$27,910,000","-$111,640,000","9.21%","-18.36%","$492,570,000","5.26%","Battery Ventures, ICONIQ Capital","$175 million","1540","$394,900","Customer engagament platform for personalized multi-channel messaging and targeted marketing campaigns.","","","http://www.braze.com","http://investors.braze.com","https://www.sec.gov/Archives/edgar/data/1676238/000119312521304909/d40379ds1.htm","https://www.sec.gov/Archives/edgar/data/1676238/000167623824000049/brze-20240131.htm"
"Bumble","BMBL","$7.92","$857,000,000","Sep 2024","$273,600,000","$1,094,400,000","-0.69%","0.78","108,207,071","2021","2014","Whitney Wolfe Herd","Austin, Texas, United States","$71,810,000","$287,240,000","36.50%","26.25%","-$613,200,000","-$2,452,800,000","-3778.24%","-224.12%","$252,060,000","-42.61%","Blackstone Group, Accel, Badoo Trading Limited","$2.2 billion","970","$1,128,200","Dating and social networking application that allows users to connect, chat, and form relationships.","","","http://www.bumble.com","http://ir.bumble.com","https://www.sec.gov/Archives/edgar/data/1830043/000119312521009745/d20761ds1.htm","https://www.sec.gov/Archives/edgar/data/1830043/000095017024022104/bmbl-20231231.htm"
"C3 AI","AI","$35.71","$4,609,000,000","Oct 2024","$94,340,000","$377,360,000","28.83%","12.21","129,067,488","2020","2009","Thomas M. Siebel","Redwood City, California, United States","-$72,320,000","-$289,280,000","5.14%","-76.66%","-$65,970,000","-$263,880,000","5.46%","-69.93%","$730,370,000","-4.18%","TPG, Breyer Capital, and Sutter Hill Ventures","$1.4 billion","930","$405,800","Enterprise AI software for developing and deploying AI applications for various industries.","","","http://www.c3.ai","http://ir.c3.ai","https://www.sec.gov/Archives/edgar/data/1577526/000162828020016443/c3ais-1.htm","https://www.sec.gov/Archives/edgar/data/1577526/000162828024028786/ai-20240430.htm"
"CCC Intelligent Solutions Holdings","CCCS","$11.89","$7,437,000,000","Sep 2024","$238,480,000","$953,920,000","7.84%","7.80","625,483,600","2021","1980","Frank Pope, David Marchese","Chicago, Illinois, United States","$56,990,000","$227,960,000","27.86%","23.90%","$2,810,000","$11,240,000","112.66%","1.18%","$286,300,000","-36.20%","N/A","N/A","2500","$381,600","Software solutions for automotive claims processing and related industries.","","","http://www.cccis.com","http://ir.cccis.com","https://www.sec.gov/Archives/edgar/data/1818201/000114036120016639/nt10013544x2_s1.htm","https://www.sec.gov/Archives/edgar/data/1818201/000095017024022253/cccs-20231231.htm"
"Certara","CERT","$10.70","$1,723,000,000","Sep 2024","$94,820,000","$379,280,000","10.80%","4.54","161,028,037","2020","2008","Mark L. Mathieu, Daniel Weiner","Princeton, New Jersey, United States","$23,180,000","$92,720,000","24.88%","24.45%","-$1,370,000","-$5,480,000","97.20%","-1.44%","$235,450,000","-15.37%","Vector Capital, Arsenal Capital Partners","$250 million","1200","$316,100","Drug development and regulatory science solutions for pharmaceutical companies to manage their drug development process.","","","http://www.certara.com","http://ir.certara.com","https://www.sec.gov/Archives/edgar/data/1827090/000110465920126924/tm2030105-7_s1.htm","https://www.sec.gov/Archives/edgar/data/1827090/000182709024000006/cert-20231231.htm"
"Check Point Software Technologies","CHKP","$189.65","$20,858,000,000","Sep 2024","$635,100,000","$2,540,400,000","6.51%","8.21","109,981,545","1996","1993","Gil Shwed, Marius Nacht, Shlomo Kramer","Tel Aviv, Israel","$231,300,000","$925,200,000","-0.69%","36.42%","$206,900,000","$827,600,000","0.93%","32.58%","$1,470,000,000","0.89%","N/A","N/A","5000","$508,100","Cybersecurity solutions including firewall and VPN software to protect networks and endpoints against cyber threats","","","http://www.checkpoint.com","http://www.checkpoint.com/about-us/investor-relations/","",""
"Clearwater Analytics","CWAN","$28.52","$6,998,000,000","Sep 2024","$115,830,000","$463,320,000","22.36%","15.10","245,371,669","2021","2003","Courtney McQuade, Michael Boren","Boise, Idaho, United States","$10,580,000","$42,320,000","410.09%","9.13%","$3,630,000","$14,520,000","292.11%","3.13%","$305,830,000","7.22%","Warburg Pincus, Permira","$175 million","1790","$258,800","Investment data management, reporting, and analytics platform for institutional investors.","","","http://www.clearwateranalytics.com","http://investors.clearwateranalytics.com","https://www.sec.gov/Archives/edgar/data/1866368/000119312521260325/d179113ds1.htm","https://www.sec.gov/Archives/edgar/data/1866368/000162828024007825/cwan-20231231.htm"
"Cloudflare","NET","$112.58","$38,637,000,000","Sep 2024","$430,080,000","$1,720,320,000","28.15%","22.46","343,195,950","2019","2009","Matthew Prince, Michelle Zatlyn, Lee Holloway","San Francisco, California, United States","-$5,380,000","-$21,520,000","46.97%","-1.25%","-$15,330,000","-$61,320,000","34.86%","-3.56%","$1,820,000,000","15.85%","New Enterprise Associates (NEA), Pelion Venture Partners, Venrock, Union Square Ventures","$332 million","3520","$488,700","Content delivery network (CDN), DDoS protection, and internet security mostly for SMBs.","","","http://www.cloudflare.com","http://www.cloudflare.net","https://www.sec.gov/Archives/edgar/data/1477333/000119312519222176/d735023ds1.htm","https://www.sec.gov/Archives/edgar/data/1477333/000147733324000013/cloud-20231231.htm"
"Cognyte Software","CGNT","$8.76","$630,000,000","Oct 2024","$89,000,000","$356,000,000","12.10%","1.77","71,917,808","2021","2019","Yuval Diskin, Ehud Schneorson","Herzliya, Israel","$1,050,000","$4,200,000","0.38%","1.18%","-$3,770,000","-$15,080,000","-172.22%","-4.24%","$101,770,000","46.75%","Advent International, Thoma Bravo","$80 million","1710","$208,200","Security analytics software for detection, investigation, and response to security threats in real-time.","","","http://www.cognyte.com","http://www.cognyte.com/investors/","",""
"Confluent","CFLT","$30.01","$9,843,000,000","Sep 2024","$250,200,000","$1,000,800,000","24.99%","9.84","327,990,670","2021","2014","Jay Kreps, Neha Narkhede, Jun Rao","Mountain View, California, United States","-$87,960,000","-$351,840,000","15.82%","-35.16%","-$74,140,000","-$296,560,000","19.99%","-29.63%","$1,860,000,000","-0.71%","Sequoia Capital, Index Ventures","$456 million","2850","$351,200","Real-time data processing and analytics including data integration, event streaming, and data management.","","","http://www.confluent.io","http://investors.confluent.io","https://www.sec.gov/Archives/edgar/data/1699838/000119312521178773/d63025ds1.htm","https://www.sec.gov/Archives/edgar/data/1699838/000095017024018036/cflt-20231231.htm"
